{
  "$schema": "./system-catalog.schema.json",
  "schema_version": "1.2",
  "architecture_version": "20.2.0",
  "bundle_version": "20.2.0",
  "capability_profiles": {
    "source": "references/capability-profiles.json",
    "sha256": "a1bb5825bc677a4a5a452254f5d0b87a5fc21efb8ddc1dcecf31107f1318bc40"
  },
  "counts": {
    "disciplines": 7,
    "discipline_skills": 112,
    "protocol_skills": 8,
    "total_skills": 120,
    "commands": 8,
    "registries": 7,
    "auditors": 8
  },
  "logical_order": [
    "narrative",
    "seo-geo",
    "social",
    "email",
    "ad",
    "influencer",
    "launch",
    "protocol"
  ],
  "layers": [
    {
      "id": "L1",
      "name": "Strategy",
      "purpose": "what we say and who we are",
      "disciplines": [
        "narrative"
      ],
      "cadence": "always-on"
    },
    {
      "id": "L2",
      "name": "Channels",
      "purpose": "always-on engines that express strategy",
      "disciplines": [
        "seo-geo",
        "social",
        "email",
        "ad",
        "influencer"
      ],
      "cadence": "always-on"
    },
    {
      "id": "L3",
      "name": "Orchestration",
      "purpose": "time-boxed moments coordinated across channels",
      "disciplines": [
        "launch"
      ],
      "cadence": "episodic"
    },
    {
      "id": "L4",
      "name": "Protocol",
      "purpose": "truth registries, governance, and working memory",
      "disciplines": [
        "protocol"
      ],
      "cadence": "continuous"
    }
  ],
  "commands": [
    "auto",
    "narrative",
    "seo-geo",
    "social",
    "email",
    "ad",
    "influencer",
    "launch"
  ],
  "disciplines": {
    "narrative": {
      "display_name": "Brand Narrative",
      "layer": "L1",
      "frameworks": [
        "TALE"
      ],
      "loop_name": "TALE",
      "loop": "Trace -> Architect -> Land -> Evaluate",
      "phase_order": [
        "trace",
        "architect",
        "land",
        "evaluate"
      ],
      "command": {
        "name": "narrative",
        "selector": "phase",
        "values": [
          "trace",
          "architect",
          "land",
          "evaluate"
        ]
      },
      "registry": "narrative",
      "gates": [
        "narrative-quality-auditor"
      ],
      "phases": {
        "trace": [
          "narrative-baseline-mapper",
          "category-narrative-mapper",
          "audience-belief-mapper",
          "positioning-truth-tracer"
        ],
        "architect": [
          "strategic-narrative-designer",
          "message-system-architect",
          "brand-language-codifier",
          "story-bank-builder"
        ],
        "land": [
          "narrative-cascade-planner",
          "pitch-narrative-builder",
          "narrative-enablement-kit",
          "proof-point-packager"
        ],
        "evaluate": [
          "narrative-quality-auditor",
          "message-test-designer",
          "narrative-resonance-monitor",
          "narrative-drift-monitor"
        ]
      }
    },
    "seo-geo": {
      "display_name": "SEO/GEO",
      "layer": "L2",
      "frameworks": [
        "CORE-EEAT",
        "CITE"
      ],
      "loop_name": "SITE",
      "loop": "Survey -> Implement -> Tune -> Evaluate",
      "phase_order": [
        "survey",
        "implement",
        "tune",
        "evaluate"
      ],
      "command": {
        "name": "seo-geo",
        "selector": "phase",
        "values": [
          "survey",
          "implement",
          "tune",
          "evaluate"
        ]
      },
      "registry": "entities",
      "gates": [
        "content-quality-auditor",
        "domain-authority-auditor"
      ],
      "phases": {
        "survey": [
          "keyword-research",
          "competitor-analysis",
          "serp-analysis",
          "content-gap-analysis"
        ],
        "implement": [
          "content-writer",
          "geo-content-optimizer",
          "serp-markup-builder",
          "page-play-builder"
        ],
        "tune": [
          "content-quality-auditor",
          "technical-seo-checker",
          "on-page-seo-checker",
          "site-structure-optimizer"
        ],
        "evaluate": [
          "domain-authority-auditor",
          "rank-tracker",
          "performance-monitor",
          "offsite-signal-analyzer"
        ]
      }
    },
    "social": {
      "display_name": "Organic Social",
      "layer": "L2",
      "frameworks": [
        "ECHO"
      ],
      "loop_name": "ECHO",
      "loop": "Explore -> Craft -> Host -> Observe",
      "phase_order": [
        "explore",
        "craft",
        "host",
        "observe"
      ],
      "command": {
        "name": "social",
        "selector": "phase",
        "values": [
          "explore",
          "craft",
          "host",
          "observe"
        ]
      },
      "registry": "channels",
      "gates": [
        "social-quality-auditor"
      ],
      "phases": {
        "explore": [
          "channel-portfolio-planner",
          "voice-dossier-builder",
          "platform-norm-profiler",
          "participation-warmup-planner"
        ],
        "craft": [
          "social-calendar-builder",
          "social-creative-builder",
          "short-video-scripter",
          "advocacy-program-designer"
        ],
        "host": [
          "social-quality-auditor",
          "engagement-inbox-manager",
          "social-selling-planner",
          "crisis-response-planner"
        ],
        "observe": [
          "social-pulse-monitor",
          "share-of-voice-tracker",
          "dark-social-attributor",
          "social-measurement-loop"
        ]
      }
    },
    "email": {
      "display_name": "Email Marketing",
      "layer": "L2",
      "frameworks": [
        "SEND"
      ],
      "loop_name": "SEND",
      "loop": "Setup -> Engage -> Nurture -> Deliver",
      "phase_order": [
        "setup",
        "engage",
        "nurture",
        "deliver"
      ],
      "command": {
        "name": "email",
        "selector": "phase",
        "values": [
          "setup",
          "engage",
          "nurture",
          "deliver"
        ]
      },
      "registry": "consent",
      "gates": [
        "email-quality-auditor"
      ],
      "phases": {
        "setup": [
          "deliverability-qa",
          "list-segment-builder",
          "list-growth-designer",
          "list-hygiene-monitor"
        ],
        "engage": [
          "email-creative-builder",
          "subject-line-lab",
          "email-render-builder",
          "dynamic-content-personalizer"
        ],
        "nurture": [
          "email-sequence-designer",
          "newsletter-monetization-planner",
          "preference-frequency-manager",
          "reactivation-specialist"
        ],
        "deliver": [
          "email-quality-auditor",
          "send-experiment-designer",
          "inbox-placement-monitor",
          "cold-outbound-sequencer"
        ]
      }
    },
    "ad": {
      "display_name": "Paid Ads",
      "layer": "L2",
      "frameworks": [
        "ROAS"
      ],
      "loop_name": "ROAS",
      "loop": "Research -> Orchestrate -> Activate -> Scale",
      "phase_order": [
        "research",
        "orchestrate",
        "activate",
        "scale"
      ],
      "command": {
        "name": "ad",
        "selector": "phase",
        "values": [
          "research",
          "orchestrate",
          "activate",
          "scale"
        ]
      },
      "registry": "claims",
      "gates": [
        "ad-account-auditor"
      ],
      "phases": {
        "research": [
          "campaign-architect",
          "audience-segment-builder",
          "search-term-miner",
          "product-feed-optimizer"
        ],
        "orchestrate": [
          "ad-creative-builder",
          "ad-test-designer",
          "bid-strategy-planner",
          "landing-experience-checker"
        ],
        "activate": [
          "ad-account-auditor",
          "conversion-signal-qa",
          "placement-exclusion-manager",
          "conversion-value-mapper"
        ],
        "scale": [
          "paid-measurement-loop",
          "attribution-reconciler",
          "budget-pacing-monitor",
          "fatigue-frequency-manager"
        ]
      }
    },
    "influencer": {
      "display_name": "Influencer Marketing",
      "layer": "L2",
      "frameworks": [
        "STAR"
      ],
      "loop_name": "STAR",
      "loop": "Scout -> Target -> Activate -> Report",
      "phase_order": [
        "scout",
        "target",
        "activate",
        "report"
      ],
      "command": {
        "name": "influencer",
        "selector": "phase",
        "values": [
          "scout",
          "target",
          "activate",
          "report"
        ]
      },
      "registry": "creators",
      "gates": [
        "creator-content-auditor"
      ],
      "phases": {
        "scout": [
          "audience-mapper",
          "trend-spotter",
          "influencer-discovery",
          "fit-scorer"
        ],
        "target": [
          "competitor-tracker",
          "campaign-planner",
          "brief-generator",
          "budget-optimizer"
        ],
        "activate": [
          "outreach-manager",
          "creator-content-auditor",
          "contract-helper",
          "content-amplifier"
        ],
        "report": [
          "landing-optimizer",
          "performance-analyzer",
          "roi-calculator",
          "report-generator"
        ]
      }
    },
    "launch": {
      "display_name": "Product Launch",
      "layer": "L3",
      "frameworks": [
        "RAMP"
      ],
      "loop_name": "RAMP",
      "loop": "Research -> Assemble -> Mobilize -> Prove",
      "phase_order": [
        "research",
        "assemble",
        "mobilize",
        "prove"
      ],
      "command": {
        "name": "launch",
        "selector": "phase",
        "values": [
          "research",